{"id":"DEC-GEI-GEN1-001","type":"decision","title":"Evaluate the hydraulic interpretation using explicit comparative testing","status":"active","version":"1.0.10","decision_status":"approved","decision_type":"test_design","question_ids":["QST-GEI-GEN1-001"],"investigation_ids":["INV-GEI-GEN1-001"],"claim_ids":["CLM-GEI-GEN1-001"],"hypothesis_ids":["HYP-GEI-001"],"rationale":"The next research step should test whether the proposed hydraulic analogy explains textual and comparative observations better than plausible non-hydraulic alternatives.","alternatives_considered":["Treat the Genesis sequence as a purely literary ordering without hydraulic analogy.","Treat water imagery as cosmological symbolism without engineering correspondence."],"selected_action":"Conduct a structured comparison of predicted hydraulic functions, textual observations, and counterevidence.","confidence":"C1","notes":"This decision authorizes testing; it does not establish the hypothesis as true."}